{
  "contract": "turbojev.final-e2e-plan.v1",
  "rust": "1.82.0",
  "node": "22",
  "python": "3.12",
  "dotnet": "8.0",
  "llamaCpp": {
    "repository": "https://github.com/ggml-org/llama.cpp.git",
    "tag": "b10964",
    "commitPrefix": "b29c606",
    "backend": "cpu"
  },
  "model": {
    "repository": "tensorblock/SmolLM2-135M-Instruct-GGUF",
    "filename": "SmolLM2-135M-Instruct-Q2_K.gguf",
    "url": "https://huggingface.co/tensorblock/SmolLM2-135M-Instruct-GGUF/resolve/main/SmolLM2-135M-Instruct-Q2_K.gguf?download=true",
    "sha256": "478cca924101ed67bb2751f597be41532b2f4817ee2ab1b0d7cc379c76e79faf",
    "quantization": "Q2_K",
    "sizeBytes": 88202816
  },
  "qualification": {
    "rounds": 12,
    "absoluteTolerance": 1e-05,
    "relativeTolerance": 1e-05,
    "maxFusedItems": 4
  },
  "languages": [
    "node-ts",
    "python",
    "c",
    "dotnet"
  ],
  "request": "tests/e2e/request.json"
}
